,Company Name,Company Description,Company Address,Company Website,Company tel Number,Company Emails,Company linkedIn,Comapany Country name
106,IMC Shipping,"IMC Shipping is the shipping arm of IMC Industrial Group, comprising IMC Dry Bulk, IMC Tankers and IMC Ship Services, as well as IMC Technical Services and IMC Solution Shipping . With a strong global presence and strategic position in Asia, IMC Shipping aims to be the preferred Asia-based Maritime Service Platform offering a wide range of services and solutions to the industry.",Stand: E-Q12,https://imcindustrialgroup.com/,(+65) 63362233,mailto:lowmeiyen@imcindustrialgroup.com,https://www.linkedin.com/company/imc-industrial-group/,Singapore
107,Industmarine,"Industmarine Engineers Pte Ltd’s continual distinction in embodying our core philosophies of innovation, the human touch and active engagement has helped establish our company as a regional leader for providing products and services pertaining to the marine industry. Today we offer a myriad of solutions to all major shipyards, ship owners, consultants, government bodies, power stations as well as the offshore industry. At Industmarine, we are fully committed to optimising the performance of our customers’ processes and helping them achieve their goals.",Stand: E-Q26,https://www.industmarine.com/,No data,No Data,No Data,Singapore
108,Inmarsat,No Data,Stand: F-E33,No Data,No data,No Data,No Data,United Kingdom
109,Innovative Manufacturing,No Data,Stand: E-P07,No Data,No data,No Data,No Data,United Kingdom
110,"Institute of Marine Engineering, Science and Technology (IMarEST)","The IMarEST is one the world's biggest membership and professional bodies for all practitioners in the marine and maritime industry. It supports over 20,000 members and over 100 organisations globally with its membership, accreditation, publication , and events services.",Stand: D-S38,https://www.imarest.org/,(+65) 64720096,mailto:andrew.wong@imarest.org,https://www.linkedin.com/company/the-institute-of-marine-engineering-science-and-technology-imarest/mycompany/,Singapore
111,Intellian Singapore Pte Ltd.,"Intellian is driven by a passion for innovation and an agile responsiveness to customer needs. As the crucial link between satellite networks and millions of people on Earth, Intellian’s leading technology and antennas empower global connectivity across oceans and continents, organizations and communities. Strategic thinking, an obsession with quality and a proven ability to deliver enables Intellian to invent for the future, creating mutual success for partners and customers as the world’s connectivity needs evolve. For more information, follow @Intellian and visit intelliantech.com.",No data,https://www.intelliantech.com/en/home,(+82) 25112244,mailto:marketing@intelliantech.com,https://www.linkedin.com/company/intelliantech,South Korea
112,Intermarine Group,No Data,Stand: F-G38,No Data,No data,No Data,No Data,Russia
113,Japan Radio Company (JRC),No Data,Stand: F-G02,No Data,No data,No Data,No Data,Japan
114,Jason Electronics (Pte) Ltd,"Jason Electronics is a leading integrated solutions provider of marine communication, navigation and automation systems. Accredited with ISO 9001 and ISO 45001, we serve a growing customer base from offices in global maritime hubs such as Singapore, China, Indonesia, Malaysia, Thailand and Europe since 1976. We offer a full spectrum of turnkey, innovative solutions that cover statutory radio surveys, annual performance tests for VDR, maintenance and after-sales services to Marine and Offshore Oil & Gas industries. Satellite airtime services are available to complement our expanding coms.",Stand: E-Q19,https://www.jason.com.sg/,(+65) 64777700,mailto:sales@jason.com.sg,https://www.linkedin.com/company/jason-electronics-pte-ltd,Singapore
115,Jjtango Electronics Pte Ltd,"Garmin was founded in 1989, and is currently incorporated in Schaffhausen, Switzerland, with headquarters located in the United States. Garmin first set foot in the aviation industry with its cutting-edge GPS navigation products almost three decades ago. Since then, Garmin's product lines have expanded to fully cover the aviation, marine, and automotive industries. Today, Garmin is the renowned leader in the aviation, marine, automotive, outdoor, and fitness markets.",Stand: D-T02,https://www.garmin.com.sg/,(+65) 98256794,mailto:admin@jjtango.com,No Data,Singapore
116,JL Group Engineering Pte Ltd,"JL Group with headquarter in Singapore, has subsidiary factory located in Shanghai China, India hyderabad. Representing office in Korea and Indonesia. JL Group’s main business focuses on Heating, Ventilation, Air Conditioning (JL Marine HVAC) systems, Ventilation Fans and also manufacturing of high-tech advance insulation material “aerogel”. Air Treatment as well as residential and commercial air-conditioning solutions.",Stand: E-P48,https://www.jlmarine.com.sg/,(+65) 90090835,mailto:georgefoo@jlgroupsg.com,No Data,Singapore
117,JMP Corporation,"JMP has been developing Flexible Impeller Pumps along with top quality rubber impellers since 1976. JMP was the first in the country to start with the business and has been expanding their business worldwide starting with a strong lead in Asia and expanding to other parts of the world. As a result, JMP has grown to be a highly reputable and reliable company manufacturing for other brand name marine engine manufacturers. With experience and technology, JMP has shown the quality required in this field which can be shown and proven with their certifications in ISO 9001.",Stand: F-E12,https://www.jmp.co.kr/,(+82) 513027337,mailto:jmp@jmpusa.com,No Data,South Korea
118,JOWA AB,JOWA has supplied the maritime industry with environmental protection equipment for more than 60 years and has earned a solid reputation. Our goal at JOWA is to continuously strive to manage and develop this goodwill. We are specialists in water treatment and protection of the marine environment. Our products are designed to contribute to the global ecology by protecting the marine environment with the latest and best technology. All our products are user friendly systems that are easy to install and operate.,Stand: E-H34,No Data,No data,No Data,https://jowa%20ab/,Singapore
119,Kelantan Electric Co.,"Kelantan Electric Co. (KEC) prides itself as one of Singapore’s few premier Marine and Offshore electrical distributor and stockist. KEC has come a long way since modest inception in the 70’s, with current inventory which includes complete IMPA code 79 electrical range, lighting luminaires, explosion proof equipment and cables. Committed to understanding customers’ needs, offering timely solutions with best business practices, in support by knowledgeable pre-and-post sales team, the last four decades is the best testimony of KEC being your preferred business partner.",Stand: E-J08,https://www.kelantanelectric.com/,No data,No Data,No Data,Singapore
120,KM Kinley Marketing Pte Ltd,"Manufacturer for Dyken water-driven gas freeing fans, Cobolt Roto Rust machines, pneumatic and electrical ventilation fans, high speed mucking winches and etc. Distributor for: SA Equip UK – ATEX explosion-proof fans, Texas Pneumatic (USA) – air mover, JetFan, ASME air manifold, Innovative Manufacturing (Canada) – NoSpray tape, anti-corrosion tape, Cengar (UK) – ATEX air saw, ATEXOR (Finland) – ATEX temporary LED lights and ATEX LED handlamp/headlamp, Nightsearcher (UK) – ATEX LED torchlight/ ATEX LED battery packed LED floodlight/ Solaris LED floodlights, etc.",Stand: E-P07,No Data,No data,No Data,No Data,No Data
121,Kobelt Manufacturing Ltd,"Kobelt Manufacturing Co. Ltd. is a Canadian-based company with almost 60 years of experience developing and producing high quality products for the marine and industrial sectors. The foundation of Kobelt is built on the twin pillars of our engineering strength alongside of our manufacturing capability. Through these two core competencies, we provide our customers with the safest, most trusted solutions for guiding and controlling movement. Kobelt embraces the demanding conditions in the various markets we serve.",Stand: F-G15,https://www.kobelt.com/,(+1) 6045723935,mailto:sales@kobelt.com,No Data,Canada
122,Kohler Singapore Pte Ltd,"For more than a century since 1920, Kohler has earned a global reputation as a pure power expert – in large part to our strict quality standards. Our complete power systems are equipped with Kohler innovation, including generators (residential, industrial, mobile, portable, and marine), automatic transfer switches, parallel switchgear and monitoring controllers and accessories for emergency, prime power and energy-management applications. Enduring the industry’s toughest testing process, every part is built to work with the entire system and perform in the most demanding environments.",Stand: F-E02,https://www.kohlerpower.com/marine,(+65) 96509032,mailto:sales.sg@kohler.com,No Data,Singapore
123,Korea Marine Equipment Association(KOMEA),"KOMEA is providing practical and outward-looking services, carrying out such pillar projects as overseas market development, support operation of overseas workstations and expansion of after-market function. On this context, KOMEA is expanding domestic and overseas cooperation networks, managing and operating Korean pavilions, dispatching of overseas trade mission, cooperative bilateral MOUs around the world, organizing seminar & conference as well as staging technology, certificates and education activities.",No data,http://www.komea.kr/komeaEngMain.do,(+82) 51 972 6477,mailto:we@komea.kr,No Data,South Korea
124,Korindo Energy (Singapore) Pte Ltd,"Headquartered in Singapore, Korindo Energy is a total trusted energy solutions provider for the marine and energy industry. Keeping in mind the importance of our customers’ needs, we aim to provide a sustainable complete lifecycle solution to support our customers throughout their entire projects’ stages. We believe to keep abreast with the current market’s technologies and innovations, along with our vast experience and technical expertise, Korindo Energy is committed to offering a total solution that offers long term cost efficiency while meeting the environmental regulations.","Stand: E-H10, F-F08",https://www.korindo-energy.com/,(+65) 63397661,mailto:sales@korindo-energy.com,https://www.linkedin.com/company/korindo-energy/,Singapore
125,KPM MARINE,No Data,Stand: D-V06,No Data,No data,No Data,No Data,No Data
126,KraftPowercon Sweden AB,"""KraftPowercon offers solutions, products, services – and drives innovation – within industrial power conversion. We create value for customers by ensuring efficient, green, and reliable processes that meet today’s and tomorrow’s demands. We are active in areas such as Electrolysis & Hydrogen, Air Pollution Control/ESP, Marine, PCB & Semiconductors, General Metal Finishing and Uninterruptible Power Systems. Headquartered in Sweden, KraftPowercon started in 1935 and today has five production facilities in Sweden, China and India and sales offices around the world.""",Stand: E-K20,No Data,No data,No Data,No Data,No Data
127,KSB ITUR,No Data,Stand: D-V06,No Data,No data,No Data,No Data,Spain
128,KVH Industries Pte. Ltd,"The leader in maritime VSAT connectivity, KVH provides unique end-to-end solutions that enable fleets worldwide to reap the benefits of digitalization, such as optimized efficiency, improved crew welfare, and cost reductions from real-time data IoT analytics. Commercial fleets worldwide rely on KVH for comprehensive connectivity solutions, including: • mini-VSAT Broadbandsm – No. 1 maritime VSAT network • KVH AgilePlans – Connectivity as a Service – with solutions for regional & global vessels • KVH Watch for dedicated IoT Connectivity & remote intervention for vessels; now with Cloud Connect",Stand: D-S22,https://www.kvh.com/,+65) 6513 0290,mailto:info@apac.kvh.com,https://www.linkedin.com/company/kvh-industries-inc-/,Singapore
129,LEEYOUNGSND,"NO GPS! NO Sensor! The DIGITAL SEXTANT is the world's first developed navigation equipment by LEEYOUNG SND and it can be used to calculate and identify the ship’s position by installing electronic device on the conventional Sextant. The electronic device is the new technology developed to enable a navigation officer to calculate and identify the ship’s position rapidly and conveniently through the embedded computing function that automatically processes all necessary procedures to calculate and identify ship’s position, such as the correction and calculation of Nautical Almanac, drawing LOP,",Stand: F-F28,http://www.leeyoungsnd.com/,(+82) 10-9900-7220,mailto:yslee127@live.co.kr,No Data,South Korea
130,Leistritz Pumpen GmbH,"Leistritz is a globally operating company, privately owned and with products made in Germany. Since 1905, we offer innovative solutions for products, technologies and services with a high level of technical expertise. Leistritz provides screw pumps from L2 to L5 series and FLEXCORE, suitable for a wide range of applications, especially for bi-directional applications!",Stand: E-M25,No Data,No data,No Data,No Data,No Data
131,LFA Global Pte Ltd,"""The company was founded in 1986 in a 1,000 square feet office at Thye Hong Centre. It has since grown into a formidable player in the marine industry. Recognizing the need to stay ahead and to be more competitive in a rapidly globalizing economy, the company was renamed LFA Global Pte Ltd in 2006. This change in name reflects the direction of the business to grow beyond the shores of Singapore and establish a foothold in the global market. LFA Global Pte Ltd runs its office and warehouse from a 22,000 square feet modern facility situated at Gul Lane on the western part of Singapore""",Stand: D-R02,https://www.lfaglobal.com/,(+65) 68619998,mailto:sales@LFAglobal.com,No Data,Singapore
132,Loipart (SEA) Pte Ltd,"Marine Galley, Laundry and Waste Management solution",Stand: F-E20,https://www.loipart.com/,(+65) 67499100,mailto:wenston.yap@loipart.sg,No Data,Singapore
133,M/s ITAJAI MARINE SERVICES PTE LTD,"ITAJAI's office are located in SINGAPORE, UNITED KINGDOM, DUBAI, NETHERLANDS, INDIA and Maintains a vast network of agents present at our main ports of business throughout the GLOBE. We are always one phone call or e-mail away. Our 24/7, 365 work days a year service not only meets but surpasses the expectations of some of the world's largest companies.",Stand: D-V08,https://www.itajaimarine.com/,No data,mailto:sales@itajaimarine.com,No Data,India
134,Mare Supply & Services,"Mare Supply & Services/Turkey, is an all-inclusive solution for ship supply and services with over 25 years of experience in ALL Turkish Ports / Shipyards & Straits. ** Ship Supply – Provisions / Bonded / Technical and Cabin stores / Safety Equipment / Nautical Publications / Etc. ** Ship Repairs & Welding Jobs ** Shipments ** Marine Specialist Services - Hold & Tank Cleaning - Services / Materials / Equipment - Safety Services such as LSA / FFE / Lifeboat / Davit / etc. - Survey Services, such as On-hire & Off-hire / Cargo Hold Condition Observation / etc. - Diving jobs, such as Underwater S",Stand: E-Q36,https://www.maresupply.com/,(+90) 2324486273,mailto:mare@maresupply.com,https://www.linkedin.com/company/mare-supply-&-services,Turkey
135,MARIN,Research for Maritime Industry,Stand: E-K31,https://www.marin.nl/en,(+31) 650691224,mailto:k.kooiker@marin.nl,https://www.linkedin.com/company/marin/,Netherlands
136,Marine International Pte Ltd,"Marine International Pte Ltd has been in the marine supply business for 52 years since 1970. We are dedicated to promoting the company to a higher level of marketing and distribution in the region. Marine International Pte Ltd is set to provide good quality products at affordable prices and high standard customer service. Our Motto: Be honest to our customers and never lose their trust We are currently agents and distributors of some of the world’s finest marine brands like:- Dometic -Air conditioning systems ,Sea Star Solutions -Steering systems- Mechanical/Hydraulic/Electronic , Jabsco /Rule",Stand: E-H08,https://www.marine-intl.com.sg/,(+65) 64473004,mailto:salesinfo@marine-intl.com.sg,No Data,Singapore
137,Marine Jet Power,"For more than 35 years, Marine Jet Power (MJP) has been redefining the waterjet market with innovation and unsurpassed quality. Engineered and built in Sweden, MJP’s proven stainless steel, mixed-flow and aluminum, axial-flow waterjets are used in many diverse applications, from fast military craft and passenger vessels to luxury yachts and workboats worldwide. Over 100 million running hours strong, MJP waterjets are designed with low operating costs and ease of maintenance in mind.",Stand: F-G07,https://www.marinejetpower.com/,No data,No Data,https://www.linkedin.com/company/marine-jet-power,Sweden
138,MARINESAT PTE. LTD.,No Data,Stand: E-L46,No Data,No data,No Data,No Data,Singapore
139,Maritec Pte Ltd,"Maritec Pte Ltd was incorporated in 1999 as a Marine Fuel Testing company. Since then, we have been providing expert Technical and Operational advice for the use of the fuels onboard vessels to an international portfolio of shipping companies. In June 2020, Maritec was acquired by Centre Testing International Group (CTI Group). The Marine Services Division of CTI Group has been fully integrated with Maritec. As the result of the acquisition and integration, we are able to leverage on the resources and strength of CTI Group.",Stand: E-P37,https://www.maritec.com.sg/,(+65) 62718622,mailto:admin@maritec.com.sg,https://sg.linkedin.com/company/cti-maritec,Singapore
140,Marlink,"Marlink is a trusted partner for fully managed smart network solutions, based on an intelligent hybrid network and unrivalled digital solutions. The company provides Smart Network Solutions, connecting people and assets around the globe and across all markets where conventional connectivity cannot reach or is not available. Marlink’s Intelligent Hybrid Network combines global satcom and terrestrial technologies via a proprietary global infrastructure. Customers operating in remote environments can rely on Marlink's multi-band connectivity services enhanced by mobile and terrestrial connectivit",Stand: F-F20,https://www.marlink.com/,65||98321822,mailto:sales.asia@marlink.com,https://www.linkedin.com/company/marlink/,Germany
141,Masson Marine Propulsion Pte Ltd,"Masson Marine is a French company established in 1908. We manufacture and sell gearbox, shaft and propeller (FPP CPP). Everything made in France Our products equip all kinds of vessels in work applications. Power ranges from 500 HP to 5000 HP, with reduction ratios as high as 14, and propeller diameters up to 5 meters. Masson Marine also has hybrid solution thanks to connection Power take off and Power take in. Our package cover all the transmission of your boat Limited to 1000 characters",Stand: D-T10,https://www.masson-marine.com/,(+65) 96289552,mailto:s.agaisteen@masson-marine.com,https://www.linkedin.com/company/masson-marine/,Singapore
142,MediaComz International Pte Ltd,"MediaComz International Pte Ltd, is a Singapore based publishing and events management company. In their stable of publications are Petromin Marine & Offshore (previously PetroMin), first published in 1974, the Asia Pacific's first and most established oil & gas and marine magazine covering exploration, drilling, production, pipeline activity, naval architecture and marine technology; and Petromin Fuels & Power (previously Hydrocarbon Asia), which covers refining, petrochemicals and gas processing since 1990. We are also a Technology Conference organizer.",Stand: D-T11,https://petrominonline.com/,(+65) 62223422,mailto:mary@mediacomz.com,No Data,Singapore
143,Merlin Diesel Systems Ltd,"Merlin Diesel has been at the forefront of aftermarket diesel fuel injection for over 70 years, from small beginnings in West Yorkshire to what it is today. Under our current chairman Ken Bramley, Merlin has grown to have branches in Lancashire, London and China, employing over 90 people with a global distribution network to over 100 countries.",Stand: E-K05,https://www.merlindiesel.com/,(+44) 01772694180,mailto:info@merlindiesel.com,https://www.linkedin.com/company/merlin-diesel-systems-ltd,United Kingdom
144,METIS Cyberspace Technology S.A.,"METIS Cyberspace Technology specializes in Data Acquisition, Real-time Performance Monitoring and Intelligent Analytics for the Maritime Industry, based on advanced Machine Learning and Artificial Intelligence techniques. Based in Athens, the core of METIS is its team of skilled engineers and researchers whose innovative thinking, maritime business know-how and expertise in high-end technologies are empowering shipping’s digital transformation.",Stand: F-E08,https://www.metis.tech/,(+30) 2130075000,mailto:info@metis.tech,https://www.linkedin.com/company/17883253/admin/,Greece
145,Milestone Systems,"Milestone Systems is a leading provider of open platform video management software; technology that helps the world see how to ensure safety, protect assets and increase business efficiency. Milestone en-ables an open platform community that drives collaboration and innovation in the development and use of network video technology, with reliable and scalable solutions that are proven in more than 500,000 sites worldwide. Founded in 1998, Milestone is a stand-alone company in the Canon Group.",Stand: E-L08,https://www.milestonesys.com/,(+65) 3158 9911,mailto:sales@milestonesys.com,https://www.linkedin.com/company/milestone-systems/mycompany/,Singapore
146,MJ DE-YI INTERNATIONAL LTD.,"We are aftermarket gasket manufacturer, focusing on producing high-quality hard material gaskets for diesel engines and engine related devices in multiple industries.",Stand: D-U11,https://www.mjgasket.com/,No data,No Data,https://www.linkedin.com/company/mjgasket/,Taiwan
147,MOBILIS,"Created in 1990, MOBILIS has stood out to be today the world leader in the Aids To Navigation sector. Manufacturer of Aids To Navigations equipment, MOBILIS designs, develops, manufactures and distributes reliable premium quality products at the cutting edge of technology to meet tomorrow’s requirements. The internal engineering department ensures continuous monitoring of products and their development in line with the needs of the markets and our customers. Our engineering solutions are personalized and meet all technical, operational and regulatory requirements.",Stand: D-T22,https://www.mobilis-sa.com/,(+33) 0442371500,mailto:mobilis@mobilis-sa.com,https://www.facebook.com/MOBILIS.NavAids/,France
148,Modern Automation & Engineering Pte Ltd,"Since 1990, Modern Automation & Engineering Pte Ltd has embarked in the marine & offshore industry and with excellence and professional experience as a marine system manufacturer in Singapore for more than 30 years. Marine system include cargo tank level & temperature monitoring system, cargo tank pressure monitoring system, ballast tank combustible gas alarm, pump room gas alarm – combustible, H2S and oxygen, bunker tank (level gauging and high level alarm), vapour emission control system, fixed type oxygen analyzer for IGS and many more.",Stand: E-N11,https://www.modernautomation.com.sg/,(+65) 64516313,mailto:enquiries@modernautomation.com.sg,No Data,Singapore
149,MOLA SUBSEA SERVICES PTE LTD,No Data,Stand: F-F32,http://www.molasubsea.com/,+65 69090903,mailto:sales@molasubsea.com,No Data,110 Tuas South Ave 3
150,Motion Smith,No Data,Stand: D-R26,No Data,No data,No Data,No Data,Singapore
151,MPCC UK LTD,Supplying original/OEM and the highest quality replacement parts for European compressors and pumps. With warehouses in Singapore and the UK we can supply your vessels on time.,Stand: E-K08,https://www.mpcc.co.uk/,No data,No Data,https://www.linkedin.com/company/mpccuklimited/,United Kingdom
152,Muns Techniek BV,"Muns Techniek is a system integrator for Hydraulic systems and Electrical controls. With more than 30 years of experience we offer Hydraulic and Electric Solutions for projects in the Maritime, Offshore and Industry. From single solutions like hydraulic winches to complete turn-key projects as jack-up systems, Muns Techniek is the ambitious partner to integrate customer demands into motion technology. One of the strengths of Muns Techniek is the capability to integrate hydraulic power with intelligent electric control and software into a full operational system. Muns Techniek has proven to be",Stand: E-J31,https://www.munstechniek.nl/,(+31) 183307000,mailto:info@munstechniek.nl,https://www.linkedin.com/company/muns-techniek-bv/mycompany/?viewAsMember=true,Netherlands
153,NABTESCO MARINE ASIA PACIFIC PTE LTD,"Nabtesco Marine Asia Pacific Pte Ltd was established on 1998 at Singapore as a key Service Station of Nabtesco for South East Asia & Oceania region. In Singapore, Nabtesco Marine Asia Pacific Pte Ltd provides service, repair, and sales of Nabtesco Marine Control Systems which are widely used by major marine diesel engine manufacturers. Our company also offers 24 hour support, troubleshooting, system inspections, and training. Limited to 1000 characters",Stand: F-D11,https://www.nabtesco-marine.com.sg/,(+65) 62256559,mailto:apm_exh@nabtesco.com.sg,No Data,Singapore
