,Company Name,Company Description,Company Address,Company Website,Company tel Number,Company Emails,Company linkedIn,Comapany Country name
51,CON-LASH SUPPLIES PTE LTD,"Con-Lash Supplies is a premier ship supplier headquartered in the maritime hub of Singapore. Specialising in 24/7, 365 service to vessels calling at the port of Singapore, we offer a diverse portfolio of solutions including general ship supply, marine logistics and ship agency. With over three decades of experience guiding us, we understand what our customers need. Together with a robust network of global partners, we are well-positioned to provide reliable, timely and cost-effective solutions to enable our customers’ fleet to sail with confidence.",Stand: D-R10,https://www.con-lash.com/,(+65) 65519522,mailto:conlash@singnet.com.sg,No Data,Singapore
52,Consilium Marine Singapore Pte Ltd,"Manufacturer, sales and service of Consilium Safety system including Fire & Gas Detection, Suppression System, Visual Flame Detectors, Fire Management System, etc.",Stand: E-H20,https://consiliumsafety.com/,(+65) +6565708998,mailto:edmund.shen@consiliumsafety.com,No Data,Singapore
53,CSCOM (BEIJING) TECHNOLOGY CO LTD,No Data,Stand: D-U06,No Data,No data,No Data,No Data,Singapore
54,Cummins Inc.,"Cummins’ marine legacy started with the creation of diesel engines with a broad range of applications from 6.7 to 95 liters for commercial, government and recreational applications. With much success. Cummins Inc. is a global technology company designing, manufacturing, distributing and servicing a broad portfolio of reliable, clean power solutions; including diesel, natural gas, hybrid, electric and other alternative solutions. Established in 1919 and headquartered in Columbus. Serving customers in more than 190 countries and territories around the world. Learn more at cummins.com",No data,https://www.cummins.com/en/sg/cummins-singapore,(+65) 97550087,mailto:cspl.sing@cummins.com,No Data,Australia
55,"Daejin Hydraulic Machinery Co., Ltd.","DAEJIN HYDRAULIC MACHINERY Co., Ltd produces 200 kinds of hydraulic tools, like RAM and PUMP, utilized in Building bridges, shipbuilding, aircraft and excavators with a wealth of experience and technique. The company also has accumulated advanced technical power and the ability for product development, producing and developing the first aluminum cylinders and pumps in Korea",Stand: F-F26,https://www.tecpos.com/,(+82) 51-325-9472,mailto:tecpos@tecpos.cpm,No Data,South Korea
56,"DAEJUNG COMPANY,LTD.","DAEJUNG. CO., LTD Supplying Mooring rope, Synthetic rope Synthetic ropes for Mooring, Towing, Winch, Anchor, Other Heavy Duty Applications Founded in 1977, Daejung Co., Ltd risen to a leading company in the sythetic rope industry, supplying various types of ropes and accumulated knowledge through its rich experience in pursuing its business. Daejung has its headquarters and main plant in Samrak-dong, Sasang-gu, Busan, as well as two manufacturing facilities in the suburban area of Gimhae, Gyeongsamnam-do. o Products 1.MONOLON ROPE 2.NYLON ROPE / POLYESTER ROPE / POLYPROPYLENE ROPE 3.ULTIMA-AR[",Stand: F-F25,https://www.daejung.net/,(+82) 513042511,mailto:skrud1575@daejung.net,No Data,South Korea
57,Damen Shipyards,"Family owned Damen Shipyards Group has been in operation for over ninety years and offers maritime solutions worldwide, through design, shipbuilding, ship repair and related services. Damen operates 35 shipyards and 20 other companies in 20 countries, supported by a worldwide sales and service network. We offer direct employment to more than 12,500 people, bringing together a total production value of 2 billion euros and delivering over 140 ships in 2020. In addition to fellowship, craftsmanship and entrepreneurship, stewardship is a starting point for Damen.",Stand: E-J20,https://www.damen.com/,(+31) 610448251,mailto:berdine.de.with@damen.com,https://www.linkedin.com/company/damen-shipyards/mycompany/,Netherlands
58,DAN-FENDER,No Data,Stand: E-J19,No Data,No data,No Data,No Data,DENMARK
59,DEIF Asia Pacific Pte Ltd,"Established in Denmark in 1933, DEIF Group is a global market leader in Green, Safe and Reliable control solutions. DEIF Asia pacific, located in Singapore, has a strong team supporting S.E.A and Pacific countries with its representative offices and partners. It is DEIF Green Vision to develop and manufacture reliable products to fully integrate multiple power sources in an efficient and seamless Microgrid Energy Management System.",Stand: F-D35,https://www.deif.sg/,(+65) 69335300,mailto:inquiry@deif.sg,https://www.linkedin.com/company/deifgroup/,Singapore
60,Delton Marine Pte Ltd,"Delton was established with the objective of supplying the Marine Industry with Fluid and Engineering Services. Unlike those traditional ""off-the-shelf"" trading companies and the ""sole distributor"" companies, we strive to offer the most applicable and reliable products from the world's leading manufacturers to suit our customers' needs. Over the years, we expanded our product range as well as our network of clients from different industries, proving ourselves to be a reliable solution provider.",Stand: D-V06,https://www.delton.com.sg/,(+65) 82987878,mailto:nickgoh@delton.com.sg,No Data,Singapore
61,DENO COMPRESSORS B.V.,No Data,Stand: E-L02,No Data,No data,No Data,No Data,Netherlands
62,DESMI,No Data,Stand: D-V06,No Data,No data,No Data,No Data,Denmark
63,Doen Waterjet,"We are a leading designer and manufacturer of waterjet propulsion systems focused on offering best-of-class waterjet products that excel in the harsh operating conditions of the commercial and military marine markets. With our extensive range of waterjets matching engine powers up to 6500kW, you can be sure that Doen WaterJets has a product offering to suit your vessel no matter big or small. Our promise is superior Performance, excellent Reliability and sheer Simplicity of installation, operation and maintenance across our entire product range.",Stand: E-Q39,https://www.doen.com/,(+61) 3 9587 3944,mailto:inquiries@doen.com,https://www.linkedin.com/company/doen-pacific,Australia
64,Dualog Singapore Pte Ltd,"""Since 1994, Dualog has developed and delivered innovative software solutions with the purpose of bringing ship and shore closer. Our purpose-built services for cybersecurity, email, data transfer, and internet management help the global shipping industry to enable the integrated ship. Our promise is to carefully look after your onboard solutions and ensure safe data transfer between ship and shore. We are on duty 24/7, and if something goes wrong, we will fix it. We deliver Innovations at sea with passion to more than 5000 ships, and we are always curious and listening to our customers. It",Stand: E-H25,http://www.dualog.com/,(+65) 62229233,mailto:hello@dualog.com,https://www.linkedin.com/company/dualog-as/,Singapore
65,E.W. Liner Charts & Publications Pte Ltd,"EW Liner Charts & Publications is an International ADMIRALTY Chart Agent established in 1995 under the leadership of Captain Prem Kumar, an ex-NOL Master Mariner with 25 years of sea-going experience. Over the years, we have diversified our products and services with the aim of becoming a one-stop supplier for your navigation-related requirements.",Stand: E-M52,https://www.ewliner.com/,(+65) 63230773,mailto:suranjan@ewliner.com,No Data,Singapore
66,Elite Marine Corporation,"""Elite Marine Corporation is an innovative high-tech enterprise specialized in integrated solution for ballast water treatment system including research, design, construction, installation and after-sale service. We provide perfect service for the global customers with our mature technology and high quality products. Customer oriented, struggle based, hard-working persistent and insisted on self-criticism is the core value of our company. Elite marine R&D team consists of domestic & foreign chief engineers and researchers. We have sales & service partner all over the world.",Stand: F-G38,https://ntelitemarine.com/,(+86) 513 5508 3922,mailto:bwts@ntelitemarine.com,No Data,China
67,Engtek Pte Ltd,"Engtek has been in marine & offshore industry for 48 years in Asia and Asia Pacific with operation and branches in China, Malaysia, Vietnam and South Africa, as well partners in Indonesia, Myanmar, India and UAE. Engtek Pte Ltd strive to contribute towards a greener marine environment, developing the ultimate goal of building decarbonisation and Green products. Engtek in-house product – E-Pod, electric thrusters not only improve the overall efficiency of the ship but also reduce the carbon footprints.",Stand: E-Q11,https://www.engtek.com.sg/,(+65) 62656288,mailto:mailbox@engtek.com.sg,No Data,Singapore
68,European Diesel Services,"EDS supplies spare parts and support services suitable for operators of RUSTON, BERGEN, PAXMAN VP185, W.H ALLEN, PERKINS and DORMAN diesel and gas engines. Lloyds Register ISO9001:2015 certified, established in 1994 and with a customer base in over 100 countries we provide costs effective supply solutions to engine operators in the Marine, Offshore, Naval/Defence, Power Generation and Rail industries worldwide.",Stand: E-K03,No Data,No data,No Data,No Data,No Data
69,Fire Fighting Systems (Far East) Pte Ltd,"Fire Fighting Systems (F.E) provides total fire-fighting solutions to various FiFi classes on tugs and other workboats. The complete package comprises equipment such as water monitors, pumps and controls systems, plus services in accordance with all class society requirements. It has a production plant in Åmål in Sweden and engineering centres in Norway and Singapore. FFS’s product range includes pumps with drivers, gearboxes, monitors, foam mixers, deluge systems, remote control systems and related equipment. FFS designs its own FiFi pumps, which are manufactured in nickel-aluminium bronze or",Stand: E-N08,No Data,No data,No Data,No Data,No Data
70,FLEMINGS SAFETY PTE LTD,"Established in 1994, Flemings Safety is specialised in manufacturing and supplying of safety apparels and Personal Protective Equipment to various markets and industries. Our extensive range of products includes Flame Retardant Clothing (FRC), Industrial Cotton Workwear, Uniforms, Spill Control supplies, Head to Toe PPE such as safety helmet, safety eyewear, hearing protection, respiratory protection, protective gloves and everything you need in any work conditions. Backed by a competent team of professionals at our core, we provide dependable solution, reliable services and competitive pricin",Stand: D-S42,https://www.flemings-safety.com/,(+65) 6442 7383,mailto:SALES@FLEMINGS-SAFETY.COM,https://www.linkedin.com/company/flemings-safety,Singapore
71,FLIR DETECTION INC (SINGAPORE BRANCH),"Teledyne FLIR designs, develops, manufactures, markets, and distributes technologies that enhance perception and awareness. We bring innovative sensing solutions into daily life through our thermal imaging, visible-light imaging, video analytics, measurement and diagnostic, and advanced threat detection systems.",Stand: D-U01,https://www.flir.asia/applications/marine/,(+65) 93686377,mailto:simon.see@teledyneflir.com,No Data,Singapore
72,FSE SAFE Projects Pte Ltd,"FSE SAFE Projects Pte Ltd, Singapore (HQ) suppliers to Oil & Gas, Petro-Chemicals and Refineries, Martime and Shipbuilding, Renewables and other related industries. Project supply worldwide for all Mechanical - Electrical - Instruments - Safety. Core Products supply: Explosion Proof Products Marine and Offshore Equipment Man Overboard Rescue Safety Fire and Marine Safety Safety Signage and Pipe Marking and Labeling Working at Heights Safety",Stand: E-Q08,https://www.fsesafe.com/,(+65) 66354526,mailto:sales@fsesafe.com,https://www.linkedin.com/company/fsesafe-singapore/,Singapore
73,Furuno Singapore Pte Ltd,"Furuno Singapore is a leading global provider of products and services for the Maritime, Oil & Gas industries. With fully integrated facilities and guided by ISO 9001 and OHSAS 18001 certification accredited by DNV, we provide turnkey solutions encompassing Design & Engineering, Supply, Installation and Commissioning of key systems. With more than 40 years of experience, Furuno Singapore continues to deliver quality integrated solutions, products and services to meet the full requirements and satisfaction of all its customers.",Stand: E-N02,https://www.furuno.sg/,(+65) 67458472,mailto:sales@furuno.sg,https://www.linkedin.com/company/furuno-singapore,Singapore
74,Garmin Corporation (Asia),No Data,Stand: D-T02,No Data,No data,No Data,No Data,Singapore
75,Gealubes Consulting & Trading Pte Ltd,"""GEALUBES is the authorized PANOLIN Marine Business Distributor in Singapore. PANOLIN is an independent high performance lubricant manufacturer with headquarters in Switzerland. The company was established in 1949 and has its core competence in the development of high performing Environmentally Acceptable Lubricants (EAL) for more than 35 years. PANOLIN focuses on fully synthetic (saturated ester technology), biodegradable, minimally toxic and non-bioaccumulating lubricants.",Stand: E-J16,https://www.gealubes.com.sg/,(+65) 6322 0830,mailto:marine@gealubes.com.sg,https://www.linkedin.com/company/gealubes/,Singapore
76,Georg Schunemann GmbH,"Schünemann has been successfully active for more than 80 years with technical competence and experience in the areas of special valves (High pressure, Seawater Valves), filters and filtration systems. Our products have high quality requirements and are partially used under extreme conditions.",Stand: E-M13,https://www.sab-bremen.de/en,(+49) 55909 24,mailto:nagel@sab-bremen.de,No Data,Germany
77,Global Echo,No Data,Stand: F-E11,No Data,No data,No Data,No Data,Korea
78,GLOBAL ECHO,SOx scrubber system manufacturer -. Full turnkey provider -. 3months lead time -. 2weeks down time,Stand: F-E11,https://www.ms-sox.com/,(+82) 1074142933,mailto:sales@ms-sox.com,https://www.linkedin.com/company/74349324/admin/,South Korea
79,Global Fire Solution Pte Ltd,"Global Fire Solution Pte Ltd (GFS) is a ISO: 9001, 14001, 45001 accredited company. We manufacture a wide range of fire-fighting foams for all industries and chemicals, mainly for maritime sector, under the GLOBALCHEM brand. GFS strives to maintain innovative foam concentrate products by moving toward developing more fluorine free products. Our vision is to build strong customer relationships that have confidence in our ability to provide a wide range of foam concentrates and chemicals of the highest quality.",Stand: E-P35,https://www%2Cgfsglobalchem.com/,(+65) 68977086,mailto:gfs@gfsglobalchem.com,No Data,Singapore
80,GLOBAL MARINE SAFETY SINGAPORE PTE LTD,"We emphasize training and personal development for all of our team members. Global Marine Safety’s pledge to quality is backed by accreditations by top safety bureaus around the globe. Our quality management system is ISO 9001 : 2015 accredited by Global Group. Global Marine Safety is also certified by ABS, BV, DNV, GL, IRS, KR, LR, Class NK, RINA, RS, U.S Department of Transportation (U.S DOT), TUV, SUD and PSB. Through our worldwide subsidiaries such as China, USA and Asia, Global Marine Safety is positioned to serve the global market.",Stand: E-P36,http://www.gms.com.sg/,No data,mailto:GMS@GMS.COM.SG,No Data,Singapore
81,Griffin Group International Pte Ltd,"Griffin Group is a global provider of products and services for the filtration industry, utilizing proprietary technology developed from over 40 years of professional experience purifying petroleum-contaminated seawater. To best serve its customers, Griffin has developed an international distribution network. Its filtration technology and support are available to customers worldwide. Griffin has ABS Type Approval by the American Bureau of Shipping for its MAS and GFS series of fully stainless steel fuel filter water separators. Griffin’s filtration expertise extends from its flagship fuel filt",Stand: E-Q28,https://griffinfilter.com/,(+65) 6570 0670,mailto:info@griffinfilter.com,No Data,Singapore
82,Gyeongnam Marine Equipment Association (GMEA),"GMEA, Gyeongnam Marine Equipment Association, is a non-profit association that represents about 1,000 marine shipbuilding and offshore equipment manufacturers in Gyeongsangnamdo province, as a center of Korean shipbuilding, offshore and LNG industries.",Stand: F-D03,https://www.gmea.or.kr/,(+82) 1072613338,mailto:2pearl@gmea.or.kr,No Data,South Korea
83,HamiltonJet Pte Ltd,"HamiltonJet Pte Ltd was formed in 1939, located at the workshop of Irishman Creek Station. HamiltonJet Pte Ltd grew out of a combination of CWF Hamilton Engineering and CWF Hamilton Marine, the two main subsidiary companies in the Hamilton Group. As the popularity of jet boats and waterjet propulsion increased rapidly throughout the 1960s and 70s, Hamilton Engineering was producing a large number of marine jet units along with its industrial equipment. During the late 1970s and early 1980s the company made the decision to concentrate on the production of waterjet units and hydraulics.",Stand: F-D19,https://www.hamiltonjet.com/,(+65) +65 6567 2202,mailto:marketing@hamiltonjet.sg,https://www.linkedin.com/company/313583/admin/,Singapore
84,Hamworthy Pumps Singapore Pte Ltd.,"Hamworthy pumps technology has a hundred year history of innovation led by some of the most respected brands in the industry e.g Kværner, Eureka, Dolphin & Hamworthy. The company was dated back to 1889 and became a renowned maker of pumps & system equipments in the marine & offshore industry. Hamworthy Pumps and pumping systems are used in much of the world's fleet and have won wide acclaim for their reliability, accessibility & efficiency. Our continued research and development has led to the introduction of a series of pumps to better serve the shipping industry, both in terms of operational",Stand: F-E28,https://www.hamworthy-pumps.com/,(+65) 88780004,mailto:jsk@hamworthy-pumps.com,https://www.linkedin.com/company/14046681/,Singapore
85,"Hangzhou HuaYan Digital Electronics Co.,Ltd","Hangzhou HuaYan digital electronic co., LTD. Is a national high-tech enterprise, specializing in the production and sales of Marine internal communications, General emergency alarm system engine room combination alarm system bridge duty alarm system, fire alarm control system, fixed local water-based fire extinguishing system, closed-circuit television monitoring systems, wiper, rotating equipment, including Windows and primary-secondary clock. lt is for export ships, military auxiliary ships, civilian ships and Marine platforms, etc. The company adheres to the ""people-oriented"" business philo",Stand: E-L41,http://www.hzhuayan.com/,(+65) 88096927,mailto:terry@kings.sg,No Data,China
86,HAPCON AUTOMATION TECHNOLOGY,No Data,Stand: D-U06,No Data,No data,No Data,No Data,Singapore
87,Hatchtec Marine Service Limited,"Hatchtec Marine Service, an ISO 9001:2015 company specialised in deck machinery. HQ based in Shanghai with offices in Guangzhou, Hong Kong & Singapore. Service stations are located in Zhoushan and Jiangsu (China) providing professional and quality service for Hatch Covers, Grabs, Cranes, Windlass & Winches to our customers locally & globally.",Stand: E-L33,https://www.hatchtec.com/,(+65) 62612757,mailto:sg@hatchtec.com,https://www.linkedin.com/in/hatchtec-marine-service-b0a520194,China
88,Heatec JieTong Pte Ltd,"Heatec Jietong is a leading provider of piping and heat exchanger services for the marine, petrochemical, oil & gas industries. Our core business activities are in the provision of heat exchanger servicing and fabrication. Heatec Jietong services various types of heat exchangers that are utilised on board marine vessels and onshore petrochemical plants and refinery. Our heat exchanger services include on-site inspection, engineering, consultancy, fabrication and restoration of main engine charged air coolers, plate coolers, condensers, heaters, freshwater generators and other heat transfer app",Stand: E-P01,http://www.heatecholdings.com/,(+65) 6861 1433,mailto:sales@heatec.com.sg,No Data,Singapore
89,Heatmaster,"We design heating systems for shipping and industry, utilizing heating media such as thermal oil, hot water and steam. Heatmaster specializes in Heat System Design: Even for the most complex of heating requirements, we create robust system designs that stand out for their durability, reliability and high efficiency. Moreover, our heating systems are easy to control and read out, thanks to their user-friendly interfaces. That is the Art of Heat System Design. The latest developments are our Organic Rankine cycle to create electricity from waste heat AND the use of LNG and Methanol in our burner",Stand: E-J36,https://www.heatmaster.nl/,(+31) 615437884,mailto:pb@heatmaster.nl,https://www.linkedin.com/company/heatmaster-bv/mycompany/,Netherlands
90,Hensoldt,"Haase, Flemming HENSOLDT's vision is to be your global partner for competitive premium electronics and solutions to meet the demand of the future Commercial Shipping Market. HENSOLDT will be presenting its innovative range of capabilities for Commercial Bridge Systems. With this being our core focus, we will be highlighting a number of products from the Manta NEO solution including our Manta NEO Integrated Navigation System and new X-band Radar.HENSOLDT - The future of safe navigation",Stand: E-K10,No Data,No data,No Data,https://www.linkedin.com/company/17896121/admin/,United Kingdom
91,Highlander Marine (Asia-Pacific) Pte Ltd,"MANUFACTURER OF VOYAGE DATA RECORDERS, RADARS, ECDIS - SALES & SERVICE OF MARINE NAVIGATION AND COMMUNICATION EQUIPMENT/SYSTEMS - SAFETY RADIO SURVEY ON BEHALF OF CLASSIFICATION SOCIETIES - VOYAGE DATA RECORDER ANNUAL PERFORMANCE TEST - SYSTEM INTEGRATOR OF MARINE NAVIGATION & COMMUNICATION SYSTEMS - TRAINING, APPOINTMENT OF SALES & SERVICE AGENTS & ENGINEERS",Stand: D-S31,https://www.highlander.sg/,(+65) 6377 3096,mailto:SALES@HIGHLANDER.SG,No Data,Singapore
92,Highlander Marine (Asia-Pacific) Pte Ltd,"MANUFACTURER OF VOYAGE DATA RECORDERS, RADARS, ECDIS - SALES & SERVICE OF MARINE NAVIGATION AND COMMUNICATION EQUIPMENT/SYSTEMS - SAFETY RADIO SURVEY ON BEHALF OF CLASSIFICATION SOCIETIES - VOYAGE DATA RECORDER ANNUAL PERFORMANCE TEST - SYSTEM INTEGRATOR OF MARINE NAVIGATION & COMMUNICATION SYSTEMS - TRAINING, APPOINTMENT OF SALES & SERVICE AGENTS & ENGINEERS",Stand: D-S31,https://www.highlander.sg/,(+65) 6377 3096,mailto:SALES@HIGHLANDER.SG,No Data,Singapore
93,Highlander Marine (Malaysia) Sdn Bhd,No Data,Stand: D-S31,No Data,No data,No Data,No Data,Malaysia
94,"HLB Networks Co., Ltd.(ex, Hyundai Lifeboats)","As manufacturer of lifeboats, release gears, marine engine and safety equipment, HLB Hetworks Co., Ltd.(Hyundai Lifeboat) is providing services and supplying genuine spare parts for lifesaving equipment.",Stand: F-H38,No Data,No data,No Data,No Data,No Data
95,HMS Far East Pte Ltd,"The leading marine suppliers in merchant shipping, we supply you with everything your on-board crew requires. Our customers also benefit from a wide range of extra services in the field of professional budget, order and supplier management.",Stand: E-M33,https://www.hms-services.com/,(+65) 62767890,mailto:info@hmsfareast.com,No Data,Singapore
96,Hoe Seng (S.K.) Pte Ltd,"Workwear, Footwear various types of PPE. Serving your fleet from Asia and beyond.",Stand: F-F38,https://www.industrialuniform.com.sg%20https//www.workXwear.com,(+65) 67476384,mailto:sales@industrialuniform.com.sg,No Data,Singapore
97,"Honeywell Analytics Asia Pacific Co., Ltd.","Honeywell manufactures a full and comprehensive range of gas detection products dedicated to all types of industrial facilities, from smaller boiler rooms to large petrochemical plants and ship building . Honeywell’s wide range of technologies and devices – gas detectors, flame detectors, natural gas alarms – provide exceptional protection at every level, ensuring the most favorable coverage, detection, hazard mitigation and life protection. Get the specific gas detection product you need and benefit from quality, functionality and ease of use.",Stand: E-H26,https://sps.honeywell.com/us/en,(+82) +61481462579,mailto:mandy.lubbe@honeywell.com,https://www.linkedin.com/company/honeywell/,South Korea
98,Honeywell Marine,No Data,Stand: E-J07,No Data,No data,No Data,No Data,Singapore
99,HOPPE SINGAPORE PTE LTD,No Data,Stand: D-U06,No Data,No data,No Data,No Data,Singapore
100,hpTECHNIK GmbH,"Oilpumps and pumpsets, filters, valves and oilmeters. Monarch nozzles for spay applications.",Stand: E-M20,No Data,No data,No Data,No Data,No Data
101,HSK workXwear Solutions Sdn Bhd,No Data,Stand: F-F38,No Data,No data,No Data,No Data,Singapore
102,Humphree,No Data,Stand: E-L02,No Data,No data,No Data,No Data,No Data
103,Hydrive Engineering,No Data,Stand: E-Q38,No Data,No data,No Data,No Data,Australia
104,Hydromaster Propulsion,"Valued for its sturdy fully-mechanical design, Hydromaster thrusters propel hundreds of ferries, barges and pontoons worldwide every day – from remote locations with no support facilities, demanding environments of marine contractors and the armed forces to state-of-the-art hybrid or full electric propulsion systems.",Stand: E-J26,No Data,No data,No Data,No Data,Netherlands
105,ICF International Pte Ltd,"ICF Group is a market leader in Asia for marine interior refurbishment. With more than 33 years of turnkey solutions, we have a wealth of knowledge that covers the Cruise & Ferry, Oil & Gas, Offshore, New Builds and Super Yacht sectors. We are a one stop solution, providing design, planning, engineering, construction and delivery; such as structural steelwork, piping, HVAC, electrical and logistics support - all coordinated from our Singapore based headquarters to any part of the world.",Stand: E-P02,https://icfint.com/,No data,No Data,No Data,"101 Eunos Ave 3, Singapore 409835"
