,Company Name,Company Description,Company Address,Company Website,Company tel Number,Company Emails,Company linkedIn,Comapany Country name
205,Securistate,"""At SecuriState, we recognise the value of enhanced security as an important component of your business. It’s our mission to provide a secure environment and protect our clients’ personnel, assets, and reputation. With a decade of experience, we are one of the leading maritime security specialists and protection experts on par with global standards. Our hand-picked security operators are highly trained to consistently deliver a keen sense of observation, detailed care, and strict vigilance. We guarantee superior industry, protection, and risk management expertise.",Stand: D-S08,https://securistate.com/about-us/,(+65) 66845650,mailto:info@securistate.com,https://sg.linkedin.com/company/securistate-pte-ltd,Singapore
206,SHANGHAI DONJUN AUTOMATION CO LTD,No Data,Stand: D-U06,No Data,No data,No Data,No Data,Singapore
207,"Shanghai Peiner SMAG Machinery Co., Ltd,",No Data,Stand: E-M06,No Data,No data,No Data,No Data,China
208,"Shenzhen Marinesat Network Technology Co., Ltd","Marinesat, an expert in Satcom and vessel informatization sector, is committed to build a smart maritime service platform so as to enhance safety and benefit of vessels and provide a happier onboard life for their crew. Integrating solutions of internet+shipping, wireless, IoT and bid data, etc. Professional satellite service operator for various scenarios like maritime, land satcom and construction sites. Serving 3500+ vessels worldwide with One-Stop network connectivity service.",Stand: E-L46,https://sg.marinesat.com/,No data,No Data,No Data,China
209,ShipParts.com,"ShipParts.com is an online platform serving various segments of the maritime and oil & gas industry. Founded as an e-procurement platform for marine equipment and spares, ShipParts.com connects Buyers with Sellers globally, providing local manufacturers with online presence and international reach. Also, to global shipowners/ ship management companies with intelligent decision support for efficient online procurement. With our continued growth, ShipParts.com now provides big data analytics and a range of solutions helping companies in their digital transformation.",Stand: E-P28,https://www.shipparts.com/,No data,mailto:sales@shipparts.com,https://www.linkedin.com/company/sps-com,Singapore
210,Shonan Design (S) Pte Ltd,"Shonan Design Singapore is a prototyping service bureau supporting R&D activities to many local and oversea companies. We are also supplier for 3D laser, structured light scanners and advanced CAD/CAM engineering solution to solve metrology, design and manufacturing challenges.",Stand: E-H30,https://www.shonan.com.sg/,(+65) 67413886,mailto:patrick@shonan.com.sg,No Data,Singapore
211,SJP Sealing Technology (S) Pte Ltd,"SJP was established in year 1984 in Singapore specializing in Mechanical Seal, Packing, Gaskets, Pneumatic and Hydraulic Seals for the marine industry. Besides sealing devices, our other range of services including Protective Coatings, Industrial & Marine Maintenance, Mechanical Seal Refurbishment Centre, as a Complete Gasket Manufacturing Facility and Inhouse Blasting & Painting Facility. We also provided qualified service engineers for pumps, valves and other mechanical equipment repair and upgrade. Our working partners are AW CHESTERTON, TEADIT, IDT, VICTOR REINZ, GPT (PIKOTEK), SGL CARBON",Stand: F-G08,https://www.sjpsealtech.com/,(+65) 91471553,mailto:yvonne@sjpsealtech.com,https://www.facebook.com/SJP-Sealing-Technology-Singapore-Office-100285775558869/,Singapore
212,SL Metals Pte Ltd,"SL Metals Pte Ltd is Singapore’s leading aluminium alloy specialist and distributor. Established in 1983, we have accumulated almost 40 years of expertise and since expanded to four locations – Singapore (Headquarter), Malaysia (Johor Bahru), China (Suzhou) and Taiwan (Taichung). With a stronghold in various industry sectors such as Shipbuilding & Repair, Semiconductor, Automotive, and others, we provide customers with high-quality products & value-added services.We carry a comprehensive range of stock from renowned brands &are equipped w/ advanced machines to supply cut-to-size dimensions.",Stand: E-Q07,https://slmetalsgroup.com/,No data,mailto:sales@slmetalsgroup.com,https://www.linkedin.com/company/slmetalsgroup,Singapore
213,Smart Frequency Technology Inc,"Smart Frequency is found in August 2018 by Acer Group and NCSIST, dedicated for the promotion of various commercial radar, optical system, communication system, and Internet of Things (IoT) technologies to domestic and foreign markets. Acer Group invested funds and NCSIST transferred Coastal surveillance radar and SAR(Synthetic Aperture Radar) as a technology share.",Stand: D-V10,https://www.sfreq.com/,No data,mailto:sales@sfreq.com,No Data,Taiwan
214,SMI,"Society of Maritime Industries (SMI) is the voice of the UK’s maritime engineering and business sector promoting and supporting companies which design, build, refit and modernise ships, and supply equipment and services for all types of commercial and naval ships, ports and terminals infrastructure, digital technology, maritime defence and security, marine science and technology, maritime autonomous systems and marine renewable energy. SMI provides a wide range of activities both internationally and in the UK for the benefit of the maritime engineering business community.",Stand: E-K02,https://www.maritimeindustries.org/,44||7553 637073,mailto:helen.stephen@maritimeindustries.org,https://www.linkedin.com/company/2470961/admin/,United Kingdom
215,SMI-DIT-UK Shipping Concierge,"Our service, launched September 21 connecting businesses with various UK Government departments as well as bringing together shipping and maritime business with the right expertise when it’s needed.  The team will support businesses looking to invest in the UK and will develop market insights to support policy decisions through ongoing dialogue with industry stakeholders. The Concierge are formed by data analysts, market insight, commercial, operations and B2B management specialists and currently sit as a team of 9.",Stand: E-K02,https://www.gov.uk/guidance/uk-shipping-concierge,(+44) 7553 637073,mailto:Joanna.Sawh@UKShippingConcierge.gov.uk,https://www.linkedin.com/company/uk-shipping-concierge,United Kingdom
216,Spear Green / Hydrive,No Data,Stand: E-Q38,No Data,No data,No Data,No Data,Australia
217,Spear Green Design,No Data,Stand: E-Q38,No Data,No data,No Data,No Data,Australia
218,Speedcast,"Speedcast is a leading communications and IT services provider, delivering critical communications services to the Maritime, Energy, Mining, Media, Telecom, Cruise, NGO, Government, and Enterprise sectors. The company leverages its global network platform to provide fully connected systems that harness technologies and applications to transform what remote operations can achieve. With the world’s most comprehensive network, Speedcast enables faster, seamless pole-to-pole coverage from a global hybrid satellite, fiber, cellular, microwave, MPLS, and IP transport network with direct access to..",Stand: D-S26,https://www.speedcast.com/,(+1) 8326682300,mailto:maritimeinfo@speedcast.com,No Data,United Kingdom
219,Speedcast,No Data,Stand: D-S26,No Data,No data,No Data,No Data,United States
220,Springer-EMS Pte Ltd,"Springer-EMS Pte Ltd was founded in 1982 as a supplier of Electrical products for Marine Industry. Today, we are an established supplier of quality products for the Marine, Offshore and Green Energy markets in Singapore, Asean and Far East Region. Our company currently represents some of the well-known European and US brands of the industries. We will be presenting some of the latest products/systems of Glamox Aqua Signal, Karl Dose, Victron Energy, Zoellner, Cassens & Path, SVT/AIK and Lopolight in APM 2022.",Stand: E-P16,https://www.springer-ems.com/,No data,mailto:sales@springer-ems.com,No Data,Singapore
221,SSB Cryogenic Equipment Pte Ltd,"Incorporated in 1996, SSB Cryogenic Equipment Pte Ltd, a subsidiary of Sing Swee Bee Group, focuses on providing cryogenic and hydrocarbon bulk liquid, ISO tank leasing, repair, maintenance and re-certification services to the gas, marine and offshore industry. The company is the owner and lessor of the largest fleet of T-75 ISO tank in Southeast Asia, providing transportation and distribution support, as well as the supply of bulk liquid on both constant and turnkey basis to the gas and marine industry. SSB Cryogenic Services Pte Ltd, a subsidiary of SSB Cryogenic Equipment, specializes in c",Stand: E-N27,https://singsweebeegroup.com/,+65) 67522711,mailto:info@ssb.com.sg,https://www.linkedin.com/company/ssb-cryogenic-equipment-pte-ltd/about/,Singapore
222,"SSL INTERNATIONAL co.,LTD.","Ship Chandler & Sun Screen For Wheel House Specialist In Accomodation (Outfitting works, Importer & Exporter)",Stand: F-G36,http://www.sslint.kr/,(+82) 1077475876,mailto:sslint@sslint.kr,No Data,South Korea
223,Suncrest Engineering Pte Ltd,"Suncrest Engineering - Sales & Service provider for the following: - BIO-SEA UV Ballast Water Treatment System - Rivertrace Engineering Oil in Water Monitoring Equipment - Victor Marine Oily Water Separator & Sewage Treatment Plant Coffin Turbo Pump (Asia) - Sales & Service provider for the following: - Scienco/Fast inTank Ballast Water Treatment System - Coffin Turbo Pump High Pressure Boiler Feed Water pumps - Compass Water Solutions Oily Water Separator, Reverse Osmosis Fresh Water Maker and Slop Water Separator - Terragon Environmental Technologies Micro Auto Gasification System - MAGS",Stand: E-K12,http://suncrest.com.sg/http://coffin.com.sg/,(+65) 6863 3393,mailto:Sales@Suncrest.com.sg,No Data,Singapore
224,SWIFT MARINE TECH SERVICES PTE LTD,"Swift Marine is renowned Service Providers in Marine Industry since 2015. We carry out Yearly / 5 Yearly Calibration & Servicing of Instruments/ systems such as Fixed and Portable Gas Detectors, Safety Equipment’s, Oil Discharge Monitoring Equipment’s (ODME), Oil Mist Detectors (OMD’s), Ullage Temperature Oil & Water Interface (UTI’s) Tapes, Bilge Alarm Monitoring Equipment’s, Automation Equipment’s, Fan Beam and Cyscan DP Positioning Equipment’s and other related automation equipment’s. One Stop Solutions for Yearly Calibration Services.",Stand: E-J07,https://www.smtssg.com/,(+65) 62505035,mailto:admin@smtssg.com,No Data,Singapore
225,Taiwan Shipbuilding Industry Association,"Taiwan Shipbuilding Industry Association(TSIA) was established in July 1967, according to the approval of regional organisation of Internal Affairs, for the regional organisation of Taiwan. It has more than 90 shipyard members engaged in boat design, manufacturing, repair, retrofit for the study and improvement now. TSIA also coordinate the relationship between peers, to promote the common interests and plan for the improved promotion of the industry and promote economic development for the purpose.",Stand: D-U13,No Data,No data,No Data,No Data,Taiwan
226,TAS GLOBAL,"Develop, Manufacture and Operate Underwater Hull Cleaning ROV and Filtration System",Stand: F-F32,https://www.usmtas.com/,No data,No Data,https://www.linkedin.com/in/jimmy-choo-340b8a203/,South Korea
227,Technique Marine Services Pte Ltd,"Since incorporation in 2006, Technique Marine Services Pte Ltd (TMSPL) has been recognised as a reliable partner and solution provider in the marine offshore, oil and gas industry in the SEA region. Working closely with numerous partners and major shipyards around the region, we serve as a one-stop solution provider, specializing in a wide range of products. Since establishment, we have expanded overseas into China and Indonesia and have been involved in key projects in the industry.",Stand: E-M05,https://www.tmspl.com.sg/,(+65) 9272 6589,mailto:sales@tmspl.com.sg,No Data,Singapore
228,"Technology Centre for Offshore and Marine, Singapore Ltd (TCOMS)","The Technology Centre for Offshore and Marine, Singapore (TCOMS) is a national R&D centre dedicated to the Marine & Offshore and Maritime sectors. We integrate research and industry expertise to co-create innovative concepts and solutions to address real world challenges. A core feature of TCOMS is the next-generation Deepwater Ocean Basin research facility which is equipped with advanced wave and current generation systems to simulate the physical ocean environment and complex scenarios that marine platforms and ships operate in.",Stand: E-Q20,https://www.tcoms.sg/,(+65) 96703639,mailto:business@tcoms.sg,https://www.linkedin.com/company/tcoms/,Singapore
229,TEHO International Inc Ltd,"TEHO GROUP – MULTI-FACETED SOLUTIONS PROVIDER FOR THE MARINE, OFFSHORE O&G, CONSTRUCTION AND REAL ESTATE INDUSTRIES Leveraging on our increasing base of loyal customers, a structured and robust inventory system, and a dedicated and competent team, TEHO Group has grown from a small local business in 1986 to become an international multi-faceted solutions provider. We were listed on the Singapore Exchange Securities Trading Limited, SGX-ST in June 2009, after a restructuring exercise to streamline and rationalise our structure, under our holding company TEHO International Inc Ltd.",Stand: E-P20,https://www.teho.com.sg/,No data,mailto:marketing@teho.com.sg,https://www.linkedin.com/company/teho-international-usa-llc,Singapore
230,Teignbridge Propellers International Ltd.,"Teignbridge Propellers design and manufacture the highest-quality high-performance propellers and sterngear for commercial, military and leisure vessels. Robust, efficient and durable, Teignbridge’s complete propulsion systems deliver world-class equipment that can optimise the performance of vessels, saving operators time and money.",Stand: E-H09,https://teignbridge.co.uk/,(+60) 122685446,mailto:simon.honeybone@teignbridge.asia,https://www.linkedin.com/company/teignbridge-propellers/,Malaysia
231,Tero Marine AS,"Part of the Ocean Technologies Group, Tero Marine Tero Marine has a vision to turn a millennium of maritime tradition and knowledge into management systems, catering for the growing demands of an industry in an ever more complex world. We are one of the world’s leading developers of marine information systems and based on a thousand years of Norwegian shipping knowledge, our product range includes systems for Planned Maintenance, Inventory Control, Procurement, Crew management and Quality & Environment.",Stand: E-K01,https://www.teromarine.com/,(+47) 65132529,mailto:sales.sg@teromarine.com,https://www.linkedin.com/company/tero-marine-as/,Norway
232,TERRAGON ENVIRONMENTAL TECHNOLOGIES,No Data,Stand: E-K12,No Data,No data,No Data,No Data,United States
233,Test Company,"Lorem ipsum dolor sit amet, consectetur adipiscing elit. In tempor purus at quam vestibulum volutpat. Proin gravida ultrices pellentesque. Proin tempor tristique erat a eleifend. Nulla efficitur quam",Stand: GH-332,https://rxglobal.com/,No data,No Data,No Data,Test Company
234,"Tetradyne Co., Ltd.","ETRADYNE is a specialized manufacturer of marine/military/industrial monitor, panel PC and computer since 1999. All the products are in-house manufactured and managed strictly for product-quality maintenance. Marine products approved by ABS, BV, DNV, KR, LR, NK, RS have been supplied since 2005. As a long-termed OEM partner of Dell, TETRADYNE has supplied marine certified Dell servers & workstations since 2005. In conjunction with TD kit (anti-vibration kit developed by TETRADYNE), marine certified Dell computer (Optiplex XE3) and monitor (19"", 24"") has been launched in 2019.",Stand: F-G32,http://tetradyne.co.kr/,(+82) 02-323-4972,mailto:sales@tetradyne.co.kr,No Data,South Korea
235,"THE SAFETY CO.,LTD.","THE SAFETY, as an affiliate of NK, is a sole business partner for the maritime service of NK Group, exclusively managing NK Group's global sales and aftersales service network.",Stand: F-G29,https://www.thesafety.com/,(+82) 82-(0)70-8892-7765,mailto:ts@thesafety.com,No Data,South Korea
236,TKF,"iSnce its founding in 1930, TKF has developed from a cable manufacturer to a leading supplier of connectivity solutions. With a broad portfolio of cables and services, we offer customers worldwide solutions for creating safe and reliable energy and data connections. Cables are the vital network of a ship, where spaces are narrow and the environment can be rough. They have to ensure the functioning of vital equipment during critical situations. At TKF we wish to support our clients with a complete marine cable portfolio specially designed for the marine environment. TKF offers more than 350 sta",Stand: E-K26,https://www.tkf.eu/,(+31) 535732255,mailto:inf@tkf.nl,No Data,Netherlands
237,Tractors Machinery International Pte Ltd,No Data,Stand: F-E26,No Data,No data,No Data,No Data,Singapore
238,Tractors Singapore Limited,"Established in January 1966, Tractors Singapore Limited (TSL) is the leading equipment dealer in Singapore. As a Cat dealer, TSL distributes a full line Cat machines, engines and propulsion systems, and also a full range of services including sales, rental, parts and after service support for the service territories of Singapore, Maldives and Christmas Island (Indian Ocean). Apart from the Cat dealership, TSL is also the distributor of COX diesel outboard, the world's first 300HP diesel outboard engine.",Stand: F-E26,https://www.tractors.com.sg/,(+65) 66638818,mailto:tractors@tractors.simedarby.com.sg,https://www.linkedin.com//tractors-singapore-ltd-,Singapore
239,TradeWinds,"Celebrating 30 years as the go-to news source in shipping, TradeWinds continues to offer market-leading coverage as it unpacks the key issues. Our global editorial team of experts offer peerless independent journalism, insight and business intelligence that simply can’t be found anywhere else. We get close to the key movers and shakers on the ground in the US, UK, Norway, Greece, Singapore, China, India and all points in-between. Shipping never sleeps – so don’t miss a moment with TradeWinds’ unrivalled round-the-clock coverage.",Stand: E-J49,https://www.tradewindsnews.com/,(+65) 90104873,mailto:amber.chang@tradewindsnews.com,https://sg.linkedin.com/company/tradewinds,Singapore
240,TRANS-ASIATIC TRADING PTE LTD,"Trans Asiatic Trading Pte Ltd is a leading trading company in industrial, marine and offshore products in South-East Asia. We represent and distribute several renowned brands in these industries and offer professional users a wide range of equipment/services within the accommodation, piping and electrical segments. Our list of clients includes major ship-owners, shipbuilders, oil rig builders, shipyard and industrial companies. At Trans Asiatic , we value our work and seek to provide outstanding services, quality products at competitive prices.",Stand: E-N32,https://www.trans-asiatic.com/,(+65) 62825376,mailto:trasia@singnet.com.sg,https://sg.linkedin.com/company/trans-asiatic-trading-pte-ltd,Singapore
241,TRANSVICTORY WINCH SYSTEM PTE LTD,"Transvictory Winch System (a subsidiary of Union Steel Holdings Limited; SGX-listed Group) is the leading manufacturer and supplier of Winches, Cranes and Hydraulic Power Units (HPU) in South East Asia. We are one of the LARGEST STOCKIST of Hydraulic Winches & HPUs in Asia as well. Our strength lies in the ability to offers you as below: - A competitive and attractive price to purchase the equipment - A competitive and attractive rental rates for lease (available for short term or long term projects) - A shorten timeline preparation.",Stand: E-N07,https://transvictorywinch.com/,(+65) 67743127,mailto:enquiry@transvictorywinch.com,https://sg.linkedin.com/company/transvictory-winch-system,Singapore
242,Tru-Marine Pte Ltd,"Tru-Marine specializes in the Maintenance, Repairs and Overhaul (MRO) of turbochargers in marine, offshore, locomotive and power plant applications. Our service dedication is grounded on innovative technology and operational excellence - where we continuously harness technology to value add with cost-effective and innovative MRO solutions across all our 7 stations in Singapore, China, UAE and The Netherlands. With a proven track record in trusted, long-standing relationships with our principals, we are positioned as a leading aftermarket turbocharger company in terms of our brand representati",Stand: E-Q02,https://www.trumarine.com/,(+65) 68618398,mailto:turbo@trumarine.com,https://linkedin.com/company/tru-marine,Singapore
243,TUFROPES PRIVATE LIMITED,MANUFACTURER OF MOORING ROPES,Stand: E-H29,https://www.tufropes.com/,(+91) 02240502700,mailto:aumarao@tufropes.com,https://www.linkedin.com/company/tufropes-pvt-ltd/mycompany/,India
244,Turbo Solutions Pte. Ltd.,No Data,Stand: D-R01,No Data,No data,No Data,No Data,Singapore
245,Twin Disc (Far East) Pte Ltd,"Since 1918, Twin Disc has been inventing, engineering and manufacturing products and technologies to make power more productive in machines, boats and off-highway vehicles. This puts unparalleled application experience into every Twin Disc product. Our range include transmissions (Quickshift), surface drives (Arneson Surface Drives), propellers (Rolla), electronic controls (EC600), maneuvering joystick controls (Express Joystick System) and thrusters (Veth).",Stand: D-S12,https://www.twindisc.com/,(+65) 68651925,mailto:ang.emily@twindisc.com,No Data,Singapore
246,Twinco Pte Ltd,"Twinco Pte Ltd. offers OEM spare parts for more than 25 years from Asia Pacific to Central America. Through our global network of local partners we provide OEM spare parts and service to shipowners, ship managers and powerplant operators all over the world. In cooperation with our German partner Carl Baguhn Hamburg we offer service and overhaul of engine components, either at our workshops in Singapore, Hamburg and Colombia or onboard your vessel. We exclusively sell OEM spare parts, making sure to deliver significant savings without compromise on quality.",Stand: D-U02,http://www.twinco.com.sg/,(+65) 65429618,mailto:sales@twinco.com.sg,https://www.linkedin.com/company/14509080,Singapore
247,UEBERALL,No Data,Stand: D-V06,No Data,No data,No Data,No Data,Germany
248,United Resources Marketing Services Pte Ltd,"Established since 1987, United Resources has been a turn-key solution provider specializing in M.R.O Consumables, Safety and Spill Control Products. Leveraging on the expertise and experience of over 50 makers, we serve our Marine clients via our Singapore, Malaysia, Rotterdam, Fujairah and Houston operations.",Stand: F-G22,https://www.unitedresources-intl.com/,(+65) 67643172,mailto:enquiry@ur-intl.com,https://www.linkedin.com/company/united-resources,Singapore
249,URECON AUTOMATION PTE LTD,"Founded in 2005. Urecon Automation Pte Ltd offers maintenance and repair, upgrades, retro-fits, system integration, installation and commissioning of system such as system controls, alarm monitoring systems, associated end devices and all connections in-between. We are known for our quality service and efficiency, and we attained accreditation of ISO 9001:2015 , OHSAS 18001:2007 and BizSafe Star award. Urecon Automation is the preferred and trusted service provider for Automation needs. Our engineers are factory trained and specialised in providing electrical and instrumentation control soluti",Stand: D-U06,http://urecon.sg/,(+65) 65695298,mailto:urecon@urecon.com.sg,No Data,Singapore
250,VAF Instruments,No Data,Stand: E-K35,No Data,No data,No Data,No Data,Netherlands
251,"Valwell Development Enterprise Co., Ltd.","Over 20 Years In The Field of Valves. ValWell Development Enterprise Co., Ltd established in 1998, is located in Taichung, Taiwan. We specialize in designing and manufacturing a full range of ball valves, line blind flange valves and double block and bleed gate valves. We are committed to technologically advanced products and continually improving to develop High Quality and zero leak technological valves.",Stand: D-V12,http://valwell.com.tw/,No data,mailto:sales@valwell.com.tw,No Data,Taiwan
252,Vance Chemicals Pte Ltd,"Vance Chemicals is the sole manufacturer of Mr McKenic® Brand of environmentally-friendly products that include all-in-one lubricants, disinfectants, contact cleaners, biodegradable degreasers and more. All our product formulations are created through extensive in-house research and development that combine our technical expertise with a deep understanding of our customers’ requirements. Being an ISO9001, ISO14001 and Bizsafe Level 3 certified company, we pride ourselves on our strong heritage in providing quality, effective and competitive solutions to our customers around the world.",Stand: E-P38,https://www.mr-mckenic.com/,(+65) 68630863,mailto:sales@mr-mckenic.com,https://www.linkedin.com/company/vance-chemicals-pte-ltd/,Singapore
253,VDL AEC Maritime,"VDL AEC Maritime: We supply SOx scrubber systems (EGCS) to the maritime industry. Next to this we're launching a Ship board Carbon Capture system (CO2 scrubber), which will be commercially available in 2023.",Stand: E-J32,https://www.vdlaecmaritime.com/co2-scrubbers/why-carbon-capture,No data,No Data,No Data,Netherlands
254,VDL Klima,No Data,Stand: E-J32,No Data,No data,No Data,No Data,Netherlands
255,VDL Klima BV,VDL Klima (Heat exchangers) and VDL AEC Maritime (SOx scrubber and Ship Board Carbon Capture) will be exhibiting together on the Holland Pavilion. For more info on VDL Klima: www.vdlklima.com,Stand: E-J32,https://www.vdlklima.com/,(+31) 622316087,mailto:j.wijdeveld@vdlaecmaritime.com,https://www.linkedin.com/company/vdlaecmaritime,Netherlands
256,VDMA,No Data,Stand: E-M31,No Data,No data,No Data,No Data,Germany
